{
  "$schema": "http://json-schema.org/draft-07/schema#",
  "$id": "https://ontouml.org/ontouml-schema/2021-02-26/Package",
  "description": "An object representing a package element. Mandatory fields: constant \"type\": \"Package\", \"id\", \"name\", \"elements\", \"propertyAssignments\". Additional fields NOT allowed.",
  "type": "object",
  "properties": {
    "type": {
      "const": "Package"
    },
    "id": {
      "$ref": "https://ontouml.org/ontouml-schema/2021-02-26/definitions#id"
    },
    "name": {
      "$ref": "https://ontouml.org/ontouml-schema/2021-02-26/definitions#text"
    },
    "description": {
      "$ref": "https://ontouml.org/ontouml-schema/2021-02-26/definitions#text"
    },
    "propertyAssignments": {
      "$ref": "https://ontouml.org/ontouml-schema/2021-02-26/definitions#propertyAssignments"
    },
    "contents": {
      "oneOf": [
        {
          "type": "null"
        },
        {
          "type": "array",
          "minItems": 1,
          "items": {
            "oneOf": [
              {
                "$ref": "https://ontouml.org/ontouml-schema/2021-02-26/Package"
              },
              {
                "$ref": "https://ontouml.org/ontouml-schema/2021-02-26/Class"
              },
              {
                "$ref": "https://ontouml.org/ontouml-schema/2021-02-26/Relation"
              },
              {
                "$ref": "https://ontouml.org/ontouml-schema/2021-02-26/GeneralizationSet"
              },
              {
                "$ref": "https://ontouml.org/ontouml-schema/2021-02-26/Generalization"
              }
            ]
          }
        }
      ]
    }
  },
  "additionalProperties": false,
  "required": ["type", "id", "name", "description", "contents", "propertyAssignments"]
}
