{
  "type": "Package",
  "id": "HK05mg6D.AAAAQbt",
  "name": "Role1",
  "description": null,
  "contents": [
    {
      "type": "Package",
      "id": "VOy5mg6D.AAAAQp1",
      "name": "Diagram1",
      "description": null,
      "propertyAssignments": null,
      "contents": [
        {
          "type": "Class",
          "id": "IsW5mg6D.AAAAQqE",
          "name": "Person",
          "description": null,
          "properties": null,
          "literals": null,
          "propertyAssignments": null,
          "stereotypes": [
            "kind"
          ],
          "allowed": [
            "functional-complex"
          ],
          "isAbstract": false,
          "isDerived": false,
          "isExtensional": null,
          "isPowertype": null,
          "order": null
        },
        {
          "type": "Class",
          "id": "ech5mg6D.AAAAQqj",
          "name": "Man",
          "description": null,
          "properties": null,
          "literals": null,
          "propertyAssignments": null,
          "stereotypes": [
            "subkind"
          ],
          "allowed": [
            "functional-complex"
          ],
          "isAbstract": false,
          "isDerived": false,
          "isExtensional": null,
          "isPowertype": null,
          "order": null
        },
        {
          "type": "Class",
          "id": "jiZ5mg6D.AAAAQrK",
          "name": "Woman",
          "description": null,
          "properties": null,
          "literals": null,
          "propertyAssignments": null,
          "stereotypes": [
            "subkind"
          ],
          "allowed": [
            "functional-complex"
          ],
          "isAbstract": false,
          "isDerived": false,
          "isExtensional": null,
          "isPowertype": null,
          "order": null
        },
        {
          "type": "Class",
          "id": "z.T5mg6D.AAAAQsY",
          "name": "Husband",
          "description": null,
          "properties": null,
          "literals": null,
          "propertyAssignments": null,
          "stereotypes": [
            "role"
          ],
          "allowed": [
            "functional-complex"
          ],
          "isAbstract": false,
          "isDerived": false,
          "isExtensional": null,
          "isPowertype": null,
          "order": null
        },
        {
          "type": "Class",
          "id": "yPX5mg6D.AAAAQtn",
          "name": "Wife",
          "description": null,
          "properties": null,
          "literals": null,
          "propertyAssignments": null,
          "stereotypes": [
            "role"
          ],
          "allowed": [
            "functional-complex"
          ],
          "isAbstract": false,
          "isDerived": false,
          "isExtensional": null,
          "isPowertype": null,
          "order": null
        }
      ]
    },
    {
      "type": "Generalization",
      "id": "Tch5mg6D.AAAAQqo",
      "name": null,
      "description": null,
      "propertyAssignments": null,
      "general": {
        "type": "Class",
        "id": "IsW5mg6D.AAAAQqE"
      },
      "specific": {
        "type": "Class",
        "id": "ech5mg6D.AAAAQqj"
      }
    },
    {
      "type": "Generalization",
      "id": "wSZ5mg6D.AAAAQrP",
      "name": null,
      "description": null,
      "propertyAssignments": null,
      "general": {
        "type": "Class",
        "id": "IsW5mg6D.AAAAQqE"
      },
      "specific": {
        "type": "Class",
        "id": "jiZ5mg6D.AAAAQrK"
      }
    },
    {
      "type": "Generalization",
      "id": "EBT5mg6D.AAAAQsd",
      "name": null,
      "description": null,
      "propertyAssignments": null,
      "general": {
        "type": "Class",
        "id": "ech5mg6D.AAAAQqj"
      },
      "specific": {
        "type": "Class",
        "id": "z.T5mg6D.AAAAQsY"
      }
    },
    {
      "type": "Generalization",
      "id": "pPX5mg6D.AAAAQts",
      "name": null,
      "description": null,
      "propertyAssignments": null,
      "general": {
        "type": "Class",
        "id": "jiZ5mg6D.AAAAQrK"
      },
      "specific": {
        "type": "Class",
        "id": "yPX5mg6D.AAAAQtn"
      }
    },
    {
      "type": "GeneralizationSet",
      "id": "Br95mg6D.AAAAQsA",
      "name": "Person",
      "description": null,
      "propertyAssignments": null,
      "categorizer": null,
      "generalizations": [
        {
          "type": "Generalization",
          "id": "Tch5mg6D.AAAAQqo"
        },
        {
          "type": "Generalization",
          "id": "wSZ5mg6D.AAAAQrP"
        }
      ],
      "isDisjoint": true,
      "isComplete": true
    }
  ],
  "propertyAssignments": null
}