{
  "type": "Package",
  "id": "qIwJNC6GAqAMEnPr",
  "name": "022",
  "description": null,
  "contents": [
    {
      "type": "Class",
      "id": "qIwJNC6GAqAMEnPs",
      "name": "boolean",
      "description": null,
      "properties": null,
      "literals": null,
      "propertyAssignments": null,
      "stereotypes": [
        "datatype"
      ],
      "isAbstract": false,
      "isDerived": false,
      "allowed": [
        "abstract"
      ],
      "isExtensional": null,
      "isPowertype": null,
      "order": null
    },
    {
      "type": "Class",
      "id": "GIwJNC6GAqAMEnPt",
      "name": "byte",
      "description": null,
      "properties": null,
      "literals": null,
      "propertyAssignments": null,
      "stereotypes": [
        "datatype"
      ],
      "isAbstract": false,
      "isDerived": false,
      "allowed": [
        "abstract"
      ],
      "isExtensional": null,
      "isPowertype": null,
      "order": null
    },
    {
      "type": "Class",
      "id": "mIwJNC6GAqAMEnPu",
      "name": "char",
      "description": null,
      "properties": null,
      "literals": null,
      "propertyAssignments": null,
      "stereotypes": [
        "datatype"
      ],
      "isAbstract": false,
      "isDerived": false,
      "allowed": [
        "abstract"
      ],
      "isExtensional": null,
      "isPowertype": null,
      "order": null
    },
    {
      "type": "Class",
      "id": "WIwJNC6GAqAMEnPv",
      "name": "double",
      "description": null,
      "properties": null,
      "literals": null,
      "propertyAssignments": null,
      "stereotypes": [
        "datatype"
      ],
      "isAbstract": false,
      "isDerived": false,
      "allowed": [
        "abstract"
      ],
      "isExtensional": null,
      "isPowertype": null,
      "order": null
    },
    {
      "type": "Class",
      "id": "WIwJNC6GAqAMEnPw",
      "name": "float",
      "description": null,
      "properties": null,
      "literals": null,
      "propertyAssignments": null,
      "stereotypes": [
        "datatype"
      ],
      "isAbstract": false,
      "isDerived": false,
      "allowed": [
        "abstract"
      ],
      "isExtensional": null,
      "isPowertype": null,
      "order": null
    },
    {
      "type": "Class",
      "id": "2IwJNC6GAqAMEnPx",
      "name": "int",
      "description": null,
      "properties": null,
      "literals": null,
      "propertyAssignments": null,
      "stereotypes": [
        "datatype"
      ],
      "isAbstract": false,
      "isDerived": false,
      "allowed": [
        "abstract"
      ],
      "isExtensional": null,
      "isPowertype": null,
      "order": null
    },
    {
      "type": "Class",
      "id": "OIwJNC6GAqAMEnPy",
      "name": "long",
      "description": null,
      "properties": null,
      "literals": null,
      "propertyAssignments": null,
      "stereotypes": [
        "datatype"
      ],
      "isAbstract": false,
      "isDerived": false,
      "allowed": [
        "abstract"
      ],
      "isExtensional": null,
      "isPowertype": null,
      "order": null
    },
    {
      "type": "Class",
      "id": "OIwJNC6GAqAMEnPz",
      "name": "short",
      "description": null,
      "properties": null,
      "literals": null,
      "propertyAssignments": null,
      "stereotypes": [
        "datatype"
      ],
      "isAbstract": false,
      "isDerived": false,
      "allowed": [
        "abstract"
      ],
      "isExtensional": null,
      "isPowertype": null,
      "order": null
    },
    {
      "type": "Class",
      "id": "uIwJNC6GAqAMEnP0",
      "name": "void",
      "description": null,
      "properties": null,
      "literals": null,
      "propertyAssignments": null,
      "stereotypes": [
        "datatype"
      ],
      "isAbstract": false,
      "isDerived": false,
      "allowed": [
        "abstract"
      ],
      "isExtensional": null,
      "isPowertype": null,
      "order": null
    },
    {
      "type": "Class",
      "id": "eIwJNC6GAqAMEnP1",
      "name": "string",
      "description": null,
      "properties": null,
      "literals": null,
      "propertyAssignments": null,
      "stereotypes": [
        "datatype"
      ],
      "isAbstract": false,
      "isDerived": false,
      "allowed": [
        "abstract"
      ],
      "isExtensional": null,
      "isPowertype": null,
      "order": null
    },
    {
      "type": "Class",
      "id": "ZxCJNC6GAqAMEnd2",
      "name": "SuperClass",
      "description": null,
      "properties": null,
      "literals": null,
      "propertyAssignments": null,
      "stereotypes": [
        "kind"
      ],
      "isAbstract": false,
      "isDerived": false,
      "allowed": [
        "functional-complex"
      ],
      "isExtensional": null,
      "isPowertype": null,
      "order": null
    },
    {
      "type": "Class",
      "id": "bniJNC6GAqAMEnd_",
      "name": "SubClass1",
      "description": null,
      "properties": null,
      "literals": null,
      "propertyAssignments": null,
      "stereotypes": [
        "role"
      ],
      "isAbstract": false,
      "isDerived": false,
      "allowed": [
        "functional-complex"
      ],
      "isExtensional": null,
      "isPowertype": null,
      "order": null
    },
    {
      "type": "Class",
      "id": "6.KJNC6GAqAMEneI",
      "name": "SubClass2",
      "description": null,
      "properties": null,
      "literals": null,
      "propertyAssignments": null,
      "stereotypes": [
        "role"
      ],
      "isAbstract": false,
      "isDerived": false,
      "allowed": [
        "functional-complex"
      ],
      "isExtensional": null,
      "isPowertype": null,
      "order": null
    },
    {
      "type": "Class",
      "id": "1i6JNC6GAqAMEneR",
      "name": "AssociatedClass",
      "description": null,
      "properties": null,
      "literals": null,
      "propertyAssignments": null,
      "stereotypes": [
        "relator"
      ],
      "isAbstract": false,
      "isDerived": false,
      "allowed": [
        "relator"
      ],
      "isExtensional": null,
      "isPowertype": null,
      "order": null
    },
    {
      "type": "Generalization",
      "id": "ZgBJNC6GAqAMEnfA",
      "name": null,
      "description": null,
      "propertyAssignments": null,
      "general": {
        "type": "Class",
        "id": "ZxCJNC6GAqAMEnd2"
      },
      "specific": {
        "type": "Class",
        "id": "bniJNC6GAqAMEnd_"
      }
    },
    {
      "type": "Generalization",
      "id": "iBBJNC6GAqAMEnfE",
      "name": null,
      "description": null,
      "propertyAssignments": null,
      "general": {
        "type": "Class",
        "id": "ZxCJNC6GAqAMEnd2"
      },
      "specific": {
        "type": "Class",
        "id": "6.KJNC6GAqAMEneI"
      }
    },
    {
      "type": "GeneralizationSet",
      "id": "AGpJNC6GAqAMEnfN",
      "name": "SuperClassType",
      "description": null,
      "propertyAssignments": null,
      "categorizer": null,
      "generalizations": [
        {
          "type": "Generalization",
          "id": "ZgBJNC6GAqAMEnfA"
        },
        {
          "type": "Generalization",
          "id": "iBBJNC6GAqAMEnfE"
        }
      ],
      "isDisjoint": true,
      "isComplete": true
    },
    {
      "type": "Relation",
      "id": "Ar5JNC6GAqAMEnfi",
      "name": null,
      "description": null,
      "properties": [
        {
          "type": "Property",
          "id": "Ar5JNC6GAqAMEnfj",
          "name": null,
          "description": null,
          "propertyType": {
            "type": "Class",
            "id": "6.KJNC6GAqAMEneI"
          },
          "cardinality": "1",
          "isDerived": false,
          "isOrdered": false,
          "isReadOnly": false,
          "stereotypes": null,
          "propertyAssignments": null,
          "subsettedProperties": null,
          "redefinedProperties": null,
          "aggregationKind": "NONE"
        },
        {
          "type": "Property",
          "id": "Ar5JNC6GAqAMEnfl",
          "name": null,
          "description": null,
          "propertyType": {
            "type": "Class",
            "id": "1i6JNC6GAqAMEneR"
          },
          "cardinality": "1..*",
          "isDerived": false,
          "isOrdered": false,
          "isReadOnly": false,
          "stereotypes": null,
          "propertyAssignments": null,
          "subsettedProperties": null,
          "redefinedProperties": null,
          "aggregationKind": "NONE"
        }
      ],
      "propertyAssignments": null,
      "stereotypes": null,
      "isAbstract": false,
      "isDerived": false
    }
  ],
  "propertyAssignments": null
}