{
  "type": "Package",
  "id": "JBiqNC6GAqAMEjwp",
  "name": "012",
  "description": null,
  "contents": [
    {
      "type": "Class",
      "id": "JBiqNC6GAqAMEjwq",
      "name": "boolean",
      "description": null,
      "properties": null,
      "literals": null,
      "propertyAssignments": null,
      "stereotypes": ["datatype"],
      "isAbstract": false,
      "isDerived": false,
      "allowed": ["abstract"],
      "isExtensional": null,
      "isPowertype": null,
      "order": null
    },
    {
      "type": "Class",
      "id": "5BiqNC6GAqAMEjwr",
      "name": "byte",
      "description": null,
      "properties": null,
      "literals": null,
      "propertyAssignments": null,
      "stereotypes": ["datatype"],
      "isAbstract": false,
      "isDerived": false,
      "allowed": ["abstract"],
      "isExtensional": null,
      "isPowertype": null,
      "order": null
    },
    {
      "type": "Class",
      "id": "5BiqNC6GAqAMEjws",
      "name": "char",
      "description": null,
      "properties": null,
      "literals": null,
      "propertyAssignments": null,
      "stereotypes": ["datatype"],
      "isAbstract": false,
      "isDerived": false,
      "allowed": ["abstract"],
      "isExtensional": null,
      "isPowertype": null,
      "order": null
    },
    {
      "type": "Class",
      "id": "FBiqNC6GAqAMEjwt",
      "name": "double",
      "description": null,
      "properties": null,
      "literals": null,
      "propertyAssignments": null,
      "stereotypes": ["datatype"],
      "isAbstract": false,
      "isDerived": false,
      "allowed": ["abstract"],
      "isExtensional": null,
      "isPowertype": null,
      "order": null
    },
    {
      "type": "Class",
      "id": "FBiqNC6GAqAMEjwu",
      "name": "float",
      "description": null,
      "properties": null,
      "literals": null,
      "propertyAssignments": null,
      "stereotypes": ["datatype"],
      "isAbstract": false,
      "isDerived": false,
      "allowed": ["abstract"],
      "isExtensional": null,
      "isPowertype": null,
      "order": null
    },
    {
      "type": "Class",
      "id": "lBiqNC6GAqAMEjwv",
      "name": "int",
      "description": null,
      "properties": null,
      "literals": null,
      "propertyAssignments": null,
      "stereotypes": ["datatype"],
      "isAbstract": false,
      "isDerived": false,
      "allowed": ["abstract"],
      "isExtensional": null,
      "isPowertype": null,
      "order": null
    },
    {
      "type": "Class",
      "id": "VBiqNC6GAqAMEjww",
      "name": "long",
      "description": null,
      "properties": null,
      "literals": null,
      "propertyAssignments": null,
      "stereotypes": ["datatype"],
      "isAbstract": false,
      "isDerived": false,
      "allowed": ["abstract"],
      "isExtensional": null,
      "isPowertype": null,
      "order": null
    },
    {
      "type": "Class",
      "id": "VBiqNC6GAqAMEjwx",
      "name": "short",
      "description": null,
      "properties": null,
      "literals": null,
      "propertyAssignments": null,
      "stereotypes": ["datatype"],
      "isAbstract": false,
      "isDerived": false,
      "allowed": ["abstract"],
      "isExtensional": null,
      "isPowertype": null,
      "order": null
    },
    {
      "type": "Class",
      "id": "1BiqNC6GAqAMEjwy",
      "name": "void",
      "description": null,
      "properties": null,
      "literals": null,
      "propertyAssignments": null,
      "stereotypes": ["datatype"],
      "isAbstract": false,
      "isDerived": false,
      "allowed": ["abstract"],
      "isExtensional": null,
      "isPowertype": null,
      "order": null
    },
    {
      "type": "Class",
      "id": "1BiqNC6GAqAMEjwz",
      "name": "string",
      "description": null,
      "properties": null,
      "literals": null,
      "propertyAssignments": null,
      "stereotypes": ["datatype"],
      "isAbstract": false,
      "isDerived": false,
      "allowed": ["abstract"],
      "isExtensional": null,
      "isPowertype": null,
      "order": null
    },
    {
      "type": "Class",
      "id": ".qyqNC6GAqAMEj.0",
      "name": "Person",
      "description": null,
      "properties": [
        {
          "type": "Property",
          "id": "FGaqNC6GAqAMEj.9",
          "name": "birthDate",
          "description": null,
          "propertyType": {
            "type": "Class",
            "id": "VomqNC6GAqAMEj_K"
          },
          "cardinality": "1",
          "isDerived": false,
          "isOrdered": false,
          "isReadOnly": false,
          "stereotypes": null,
          "propertyAssignments": null,
          "subsettedProperties": null,
          "redefinedProperties": null,
          "aggregationKind": "NONE"
        }
      ],
      "literals": null,
      "propertyAssignments": null,
      "stereotypes": ["kind"],
      "isAbstract": false,
      "isDerived": false,
      "allowed": ["functional-complex"],
      "isExtensional": null,
      "isPowertype": null,
      "order": null
    },
    {
      "type": "Class",
      "id": "VomqNC6GAqAMEj_K",
      "name": "Date",
      "description": null,
      "properties": null,
      "literals": null,
      "propertyAssignments": null,
      "stereotypes": null,
      "isAbstract": false,
      "isDerived": false,
      "allowed": null,
      "isExtensional": null,
      "isPowertype": null,
      "order": null
    },
    {
      "type": "Class",
      "id": "lc.qNC6GAqAMEj_m",
      "name": "Employee",
      "description": null,
      "properties": [
        {
          "type": "Property",
          "id": "1OxqNC6GAqAMEj_1",
          "name": "test",
          "description": null,
          "propertyType": {
            "type": "Class",
            "id": "1BiqNC6GAqAMEjwz"
          },
          "cardinality": "1",
          "isDerived": false,
          "isOrdered": false,
          "isReadOnly": false,
          "stereotypes": null,
          "propertyAssignments": null,
          "subsettedProperties": null,
          "redefinedProperties": null,
          "aggregationKind": "NONE"
        }
      ],
      "literals": null,
      "propertyAssignments": null,
      "stereotypes": ["role"],
      "isAbstract": false,
      "isDerived": false,
      "allowed": ["functional-complex"],
      "isExtensional": null,
      "isPowertype": null,
      "order": null
    },
    {
      "type": "Generalization",
      "id": "qtZqNC6GAqAMEkAH",
      "name": null,
      "description": null,
      "propertyAssignments": null,
      "general": {
        "type": "Class",
        "id": ".qyqNC6GAqAMEj.0"
      },
      "specific": {
        "type": "Class",
        "id": "lc.qNC6GAqAMEj_m"
      }
    }
  ],
  "propertyAssignments": null
}
