{
  "type": "Package",
  "id": "SaL.mg6D.AAAAQBO",
  "name": "Subkind1",
  "description": null,
  "contents": [
    {
      "type": "Class",
      "isExtensional": null,
      "isPowertype": null,
      "order": null,
      "allowed": null,
      "id": "WaL.mg6D.AAAAQBQ",
      "name": "boolean",
      "description": null,
      "properties": null,
      "literals": null,
      "propertyAssignments": null,
      "stereotypes": ["datatype"],
      "isAbstract": false,
      "isDerived": false
    },
    {
      "type": "Class",
      "isExtensional": null,
      "isPowertype": null,
      "order": null,
      "allowed": null,
      "id": "NaL.mg6D.AAAAQBR",
      "name": "byte",
      "description": null,
      "properties": null,
      "literals": null,
      "propertyAssignments": null,
      "stereotypes": ["datatype"],
      "isAbstract": false,
      "isDerived": false
    },
    {
      "type": "Class",
      "isExtensional": null,
      "isPowertype": null,
      "order": null,
      "allowed": null,
      "id": "taL.mg6D.AAAAQBS",
      "name": "char",
      "description": null,
      "properties": null,
      "literals": null,
      "propertyAssignments": null,
      "stereotypes": ["datatype"],
      "isAbstract": false,
      "isDerived": false
    },
    {
      "type": "Class",
      "isExtensional": null,
      "isPowertype": null,
      "order": null,
      "allowed": null,
      "id": "taL.mg6D.AAAAQBT",
      "name": "double",
      "description": null,
      "properties": null,
      "literals": null,
      "propertyAssignments": null,
      "stereotypes": ["datatype"],
      "isAbstract": false,
      "isDerived": false
    },
    {
      "type": "Class",
      "isExtensional": null,
      "isPowertype": null,
      "order": null,
      "allowed": null,
      "id": "taL.mg6D.AAAAQBU",
      "name": "float",
      "description": null,
      "properties": null,
      "literals": null,
      "propertyAssignments": null,
      "stereotypes": ["datatype"],
      "isAbstract": false,
      "isDerived": false
    },
    {
      "type": "Class",
      "isExtensional": null,
      "isPowertype": null,
      "order": null,
      "allowed": null,
      "id": "daL.mg6D.AAAAQBV",
      "name": "int",
      "description": null,
      "properties": null,
      "literals": null,
      "propertyAssignments": null,
      "stereotypes": ["datatype"],
      "isAbstract": false,
      "isDerived": false
    },
    {
      "type": "Class",
      "isExtensional": null,
      "isPowertype": null,
      "order": null,
      "allowed": null,
      "id": "daL.mg6D.AAAAQBW",
      "name": "long",
      "description": null,
      "properties": null,
      "literals": null,
      "propertyAssignments": null,
      "stereotypes": ["datatype"],
      "isAbstract": false,
      "isDerived": false
    },
    {
      "type": "Class",
      "isExtensional": null,
      "isPowertype": null,
      "order": null,
      "allowed": null,
      "id": "daL.mg6D.AAAAQBX",
      "name": "short",
      "description": null,
      "properties": null,
      "literals": null,
      "propertyAssignments": null,
      "stereotypes": ["datatype"],
      "isAbstract": false,
      "isDerived": false
    },
    {
      "type": "Class",
      "isExtensional": null,
      "isPowertype": null,
      "order": null,
      "allowed": null,
      "id": "9aL.mg6D.AAAAQBY",
      "name": "void",
      "description": null,
      "properties": null,
      "literals": null,
      "propertyAssignments": null,
      "stereotypes": ["datatype"],
      "isAbstract": false,
      "isDerived": false
    },
    {
      "type": "Class",
      "isExtensional": null,
      "isPowertype": null,
      "order": null,
      "allowed": null,
      "id": "9aL.mg6D.AAAAQBZ",
      "name": "string",
      "description": null,
      "properties": null,
      "literals": null,
      "propertyAssignments": null,
      "stereotypes": ["datatype"],
      "isAbstract": false,
      "isDerived": false
    },
    {
      "type": "Package",
      "id": "CK0hmg6D.AAAAQXz",
      "name": "Diagram1",
      "description": null,
      "propertyAssignments": null,
      "contents": [
        {
          "type": "Class",
          "isExtensional": null,
          "isPowertype": null,
          "order": null,
          "allowed": null,
          "id": "1DWBmg6D.AAAAQWV",
          "name": "Person",
          "description": null,
          "properties": null,
          "literals": null,
          "propertyAssignments": null,
          "stereotypes": ["kind"],
          "isAbstract": false,
          "isDerived": false
        },
        {
          "type": "Class",
          "isExtensional": null,
          "isPowertype": null,
          "order": null,
          "allowed": null,
          "id": "vmFBmg6D.AAAAQXE",
          "name": "Man",
          "description": null,
          "properties": null,
          "literals": null,
          "propertyAssignments": null,
          "stereotypes": ["subkind"],
          "isAbstract": false,
          "isDerived": false
        },
        {
          "type": "Class",
          "isExtensional": null,
          "isPowertype": null,
          "order": null,
          "allowed": null,
          "id": "kX.Rmg6D.AAAAQYU",
          "name": "Woman",
          "description": null,
          "properties": null,
          "literals": null,
          "propertyAssignments": null,
          "stereotypes": ["subkind"],
          "isAbstract": false,
          "isDerived": false
        }
      ]
    },
    {
      "type": "Generalization",
      "id": "uWFBmg6D.AAAAQXJ",
      "name": null,
      "description": null,
      "propertyAssignments": null,
      "general": {
        "type": "Class",
        "id": "1DWBmg6D.AAAAQWV"
      },
      "specific": {
        "type": "Class",
        "id": "vmFBmg6D.AAAAQXE"
      }
    },
    {
      "type": "Generalization",
      "id": "RX.Rmg6D.AAAAQYZ",
      "name": null,
      "description": null,
      "propertyAssignments": null,
      "general": {
        "type": "Class",
        "id": "1DWBmg6D.AAAAQWV"
      },
      "specific": {
        "type": "Class",
        "id": "kX.Rmg6D.AAAAQYU"
      }
    },
    {
      "type": "GeneralizationSet",
      "id": "uczRmg6D.AAAAQZM",
      "name": "Person",
      "description": null,
      "propertyAssignments": null,
      "categorizer": null,
      "generalizations": [
        {
          "type": "Generalization",
          "id": "uWFBmg6D.AAAAQXJ"
        },
        {
          "type": "Generalization",
          "id": "RX.Rmg6D.AAAAQYZ"
        }
      ],
      "isDisjoint": true,
      "isComplete": true
    }
  ],
  "propertyAssignments": null
}
