{
  "type": "Package",
  "id": "OhzJNC6GAqAMEnf.",
  "name": "023",
  "description": null,
  "contents": [
    {
      "type": "Class",
      "id": "uhzJNC6GAqAMEnf_",
      "name": "boolean",
      "description": null,
      "properties": null,
      "literals": null,
      "propertyAssignments": null,
      "stereotypes": ["datatype"],
      "isAbstract": false,
      "isDerived": false,
      "allowed": ["abstract"],
      "isExtensional": null,
      "isPowertype": null,
      "order": null
    },
    {
      "type": "Class",
      "id": "BhzJNC6GAqAMEngA",
      "name": "byte",
      "description": null,
      "properties": null,
      "literals": null,
      "propertyAssignments": null,
      "stereotypes": ["datatype"],
      "isAbstract": false,
      "isDerived": false,
      "allowed": ["abstract"],
      "isExtensional": null,
      "isPowertype": null,
      "order": null
    },
    {
      "type": "Class",
      "id": "hhzJNC6GAqAMEngB",
      "name": "char",
      "description": null,
      "properties": null,
      "literals": null,
      "propertyAssignments": null,
      "stereotypes": ["datatype"],
      "isAbstract": false,
      "isDerived": false,
      "allowed": ["abstract"],
      "isExtensional": null,
      "isPowertype": null,
      "order": null
    },
    {
      "type": "Class",
      "id": "RhzJNC6GAqAMEngC",
      "name": "double",
      "description": null,
      "properties": null,
      "literals": null,
      "propertyAssignments": null,
      "stereotypes": ["datatype"],
      "isAbstract": false,
      "isDerived": false,
      "allowed": ["abstract"],
      "isExtensional": null,
      "isPowertype": null,
      "order": null
    },
    {
      "type": "Class",
      "id": "xhzJNC6GAqAMEngD",
      "name": "float",
      "description": null,
      "properties": null,
      "literals": null,
      "propertyAssignments": null,
      "stereotypes": ["datatype"],
      "isAbstract": false,
      "isDerived": false,
      "allowed": ["abstract"],
      "isExtensional": null,
      "isPowertype": null,
      "order": null
    },
    {
      "type": "Class",
      "id": "xhzJNC6GAqAMEngE",
      "name": "int",
      "description": null,
      "properties": null,
      "literals": null,
      "propertyAssignments": null,
      "stereotypes": ["datatype"],
      "isAbstract": false,
      "isDerived": false,
      "allowed": ["abstract"],
      "isExtensional": null,
      "isPowertype": null,
      "order": null
    },
    {
      "type": "Class",
      "id": "JhzJNC6GAqAMEngF",
      "name": "long",
      "description": null,
      "properties": null,
      "literals": null,
      "propertyAssignments": null,
      "stereotypes": ["datatype"],
      "isAbstract": false,
      "isDerived": false,
      "allowed": ["abstract"],
      "isExtensional": null,
      "isPowertype": null,
      "order": null
    },
    {
      "type": "Class",
      "id": "phzJNC6GAqAMEngG",
      "name": "short",
      "description": null,
      "properties": null,
      "literals": null,
      "propertyAssignments": null,
      "stereotypes": ["datatype"],
      "isAbstract": false,
      "isDerived": false,
      "allowed": ["abstract"],
      "isExtensional": null,
      "isPowertype": null,
      "order": null
    },
    {
      "type": "Class",
      "id": "phzJNC6GAqAMEngH",
      "name": "void",
      "description": null,
      "properties": null,
      "literals": null,
      "propertyAssignments": null,
      "stereotypes": ["datatype"],
      "isAbstract": false,
      "isDerived": false,
      "allowed": ["abstract"],
      "isExtensional": null,
      "isPowertype": null,
      "order": null
    },
    {
      "type": "Class",
      "id": "ZhzJNC6GAqAMEngI",
      "name": "string",
      "description": null,
      "properties": null,
      "literals": null,
      "propertyAssignments": null,
      "stereotypes": ["datatype"],
      "isAbstract": false,
      "isDerived": false,
      "allowed": ["abstract"],
      "isExtensional": null,
      "isPowertype": null,
      "order": null
    },
    {
      "type": "Class",
      "id": "wdrJNC6GAqAMEnuJ",
      "name": "SuperClass",
      "description": null,
      "properties": null,
      "literals": null,
      "propertyAssignments": null,
      "stereotypes": ["kind"],
      "isAbstract": false,
      "isDerived": false,
      "allowed": ["functional-complex"],
      "isExtensional": null,
      "isPowertype": null,
      "order": null
    },
    {
      "type": "Class",
      "id": "eP7JNC6GAqAMEnuS",
      "name": "SubClass1",
      "description": null,
      "properties": null,
      "literals": null,
      "propertyAssignments": null,
      "stereotypes": ["role"],
      "isAbstract": false,
      "isDerived": false,
      "allowed": ["functional-complex"],
      "isExtensional": null,
      "isPowertype": null,
      "order": null
    },
    {
      "type": "Class",
      "id": "F2nJNC6GAqAMEnub",
      "name": "SubClass2",
      "description": null,
      "properties": null,
      "literals": null,
      "propertyAssignments": null,
      "stereotypes": ["role"],
      "isAbstract": false,
      "isDerived": false,
      "allowed": ["functional-complex"],
      "isExtensional": null,
      "isPowertype": null,
      "order": null
    },
    {
      "type": "Class",
      "id": "7bXJNC6GAqAMEnuk",
      "name": "AssociatedClass",
      "description": null,
      "properties": null,
      "literals": null,
      "propertyAssignments": null,
      "stereotypes": ["relator"],
      "isAbstract": false,
      "isDerived": false,
      "allowed": ["relator"],
      "isExtensional": null,
      "isPowertype": null,
      "order": null
    },
    {
      "type": "Generalization",
      "id": "gm_JNC6GAqAMEnvN",
      "name": null,
      "description": null,
      "propertyAssignments": null,
      "general": {
        "type": "Class",
        "id": "wdrJNC6GAqAMEnuJ"
      },
      "specific": {
        "type": "Class",
        "id": "eP7JNC6GAqAMEnuS"
      }
    },
    {
      "type": "Generalization",
      "id": "m3_JNC6GAqAMEnvR",
      "name": null,
      "description": null,
      "propertyAssignments": null,
      "general": {
        "type": "Class",
        "id": "wdrJNC6GAqAMEnuJ"
      },
      "specific": {
        "type": "Class",
        "id": "F2nJNC6GAqAMEnub"
      }
    },
    {
      "type": "GeneralizationSet",
      "id": "mKwpNC6GAqAMEnvY",
      "name": "SuperClassType",
      "description": null,
      "propertyAssignments": null,
      "categorizer": null,
      "generalizations": [
        {
          "type": "Generalization",
          "id": "gm_JNC6GAqAMEnvN"
        },
        {
          "type": "Generalization",
          "id": "m3_JNC6GAqAMEnvR"
        }
      ],
      "isDisjoint": true,
      "isComplete": false
    },
    {
      "type": "Relation",
      "id": "IPopNC6GAqAMEnvr",
      "name": null,
      "description": null,
      "properties": [
        {
          "type": "Property",
          "id": "IPopNC6GAqAMEnvs",
          "name": null,
          "description": null,
          "propertyType": {
            "type": "Class",
            "id": "F2nJNC6GAqAMEnub"
          },
          "cardinality": "1",
          "isDerived": false,
          "isOrdered": false,
          "isReadOnly": false,
          "stereotypes": null,
          "propertyAssignments": null,
          "subsettedProperties": null,
          "redefinedProperties": null,
          "aggregationKind": "NONE"
        },
        {
          "type": "Property",
          "id": "IPopNC6GAqAMEnvu",
          "name": null,
          "description": null,
          "propertyType": {
            "type": "Class",
            "id": "7bXJNC6GAqAMEnuk"
          },
          "cardinality": "1..*",
          "isDerived": false,
          "isOrdered": false,
          "isReadOnly": false,
          "stereotypes": null,
          "propertyAssignments": null,
          "subsettedProperties": null,
          "redefinedProperties": null,
          "aggregationKind": "NONE"
        }
      ],
      "propertyAssignments": null,
      "stereotypes": null,
      "isAbstract": false,
      "isDerived": false
    }
  ],
  "propertyAssignments": null
}
