{
  "type": "Package",
  "id": "nqMoNC6GAqAMEgu7",
  "name": "003",
  "description": null,
  "contents": [
    {
      "type": "Class",
      "id": "nqMoNC6GAqAMEgu8",
      "name": "boolean",
      "description": null,
      "properties": null,
      "literals": null,
      "propertyAssignments": null,
      "stereotypes": ["datatype"],
      "isAbstract": false,
      "isDerived": false,
      "allowed": ["abstract"],
      "isExtensional": null,
      "isPowertype": null,
      "order": null
    },
    {
      "type": "Class",
      "id": "PqMoNC6GAqAMEgu9",
      "name": "byte",
      "description": null,
      "properties": null,
      "literals": null,
      "propertyAssignments": null,
      "stereotypes": ["datatype"],
      "isAbstract": false,
      "isDerived": false,
      "allowed": ["abstract"],
      "isExtensional": null,
      "isPowertype": null,
      "order": null
    },
    {
      "type": "Class",
      "id": "vqMoNC6GAqAMEgu.",
      "name": "char",
      "description": null,
      "properties": null,
      "literals": null,
      "propertyAssignments": null,
      "stereotypes": ["datatype"],
      "isAbstract": false,
      "isDerived": false,
      "allowed": ["abstract"],
      "isExtensional": null,
      "isPowertype": null,
      "order": null
    },
    {
      "type": "Class",
      "id": "vqMoNC6GAqAMEgu_",
      "name": "double",
      "description": null,
      "properties": null,
      "literals": null,
      "propertyAssignments": null,
      "stereotypes": ["datatype"],
      "isAbstract": false,
      "isDerived": false,
      "allowed": ["abstract"],
      "isExtensional": null,
      "isPowertype": null,
      "order": null
    },
    {
      "type": "Class",
      "id": "fqMoNC6GAqAMEgvA",
      "name": "float",
      "description": null,
      "properties": null,
      "literals": null,
      "propertyAssignments": null,
      "stereotypes": ["datatype"],
      "isAbstract": false,
      "isDerived": false,
      "allowed": ["abstract"],
      "isExtensional": null,
      "isPowertype": null,
      "order": null
    },
    {
      "type": "Class",
      "id": "_qMoNC6GAqAMEgvB",
      "name": "int",
      "description": null,
      "properties": null,
      "literals": null,
      "propertyAssignments": null,
      "stereotypes": ["datatype"],
      "isAbstract": false,
      "isDerived": false,
      "allowed": ["abstract"],
      "isExtensional": null,
      "isPowertype": null,
      "order": null
    },
    {
      "type": "Class",
      "id": "AaMoNC6GAqAMEgvC",
      "name": "long",
      "description": null,
      "properties": null,
      "literals": null,
      "propertyAssignments": null,
      "stereotypes": ["datatype"],
      "isAbstract": false,
      "isDerived": false,
      "allowed": ["abstract"],
      "isExtensional": null,
      "isPowertype": null,
      "order": null
    },
    {
      "type": "Class",
      "id": "AaMoNC6GAqAMEgvD",
      "name": "short",
      "description": null,
      "properties": null,
      "literals": null,
      "propertyAssignments": null,
      "stereotypes": ["datatype"],
      "isAbstract": false,
      "isDerived": false,
      "allowed": ["abstract"],
      "isExtensional": null,
      "isPowertype": null,
      "order": null
    },
    {
      "type": "Class",
      "id": "gaMoNC6GAqAMEgvE",
      "name": "void",
      "description": null,
      "properties": null,
      "literals": null,
      "propertyAssignments": null,
      "stereotypes": ["datatype"],
      "isAbstract": false,
      "isDerived": false,
      "allowed": ["abstract"],
      "isExtensional": null,
      "isPowertype": null,
      "order": null
    },
    {
      "type": "Class",
      "id": "QaMoNC6GAqAMEgvF",
      "name": "string",
      "description": null,
      "properties": null,
      "literals": null,
      "propertyAssignments": null,
      "stereotypes": ["datatype"],
      "isAbstract": false,
      "isDerived": false,
      "allowed": ["abstract"],
      "isExtensional": null,
      "isPowertype": null,
      "order": null
    },
    {
      "type": "Class",
      "id": "vqSoNC6GAqAMEg9H",
      "name": "NamedEntity",
      "description": null,
      "properties": [
        {
          "type": "Property",
          "id": "15doNC6GAqAMEg.A",
          "name": "name",
          "description": null,
          "propertyType": {
            "type": "Class",
            "id": "QaMoNC6GAqAMEgvF"
          },
          "cardinality": "1",
          "isDerived": false,
          "isOrdered": false,
          "isReadOnly": false,
          "stereotypes": null,
          "propertyAssignments": null,
          "subsettedProperties": null,
          "redefinedProperties": null,
          "aggregationKind": "NONE"
        }
      ],
      "literals": null,
      "propertyAssignments": null,
      "stereotypes": ["category"],
      "isAbstract": true,
      "isDerived": false,
      "allowed": ["functional-complex"],
      "isExtensional": null,
      "isPowertype": null,
      "order": null
    },
    {
      "type": "Class",
      "id": "CIKoNC6GAqAMEg9Q",
      "name": "Person",
      "description": null,
      "properties": [
        {
          "type": "Property",
          "id": "CXnoNC6GAqAMEg_F",
          "name": "birth_date",
          "description": null,
          "propertyType": {
            "type": "Class",
            "id": "N0voNC6GAqAMEg_S"
          },
          "cardinality": "0..1",
          "isDerived": false,
          "isOrdered": false,
          "isReadOnly": false,
          "stereotypes": null,
          "propertyAssignments": null,
          "subsettedProperties": null,
          "redefinedProperties": null,
          "aggregationKind": "NONE"
        }
      ],
      "literals": null,
      "propertyAssignments": null,
      "stereotypes": ["kind"],
      "isAbstract": false,
      "isDerived": false,
      "allowed": ["functional-complex"],
      "isExtensional": null,
      "isPowertype": null,
      "order": null
    },
    {
      "type": "Class",
      "id": "E4qoNC6GAqAMEg9Z",
      "name": "Organization",
      "description": null,
      "properties": [
        {
          "type": "Property",
          "id": "xFoYNC6GAqAMEg_r",
          "name": "address",
          "description": null,
          "propertyType": {
            "type": "Class",
            "id": "QaMoNC6GAqAMEgvF"
          },
          "cardinality": "0..1",
          "isDerived": false,
          "isOrdered": false,
          "isReadOnly": false,
          "stereotypes": null,
          "propertyAssignments": null,
          "subsettedProperties": null,
          "redefinedProperties": null,
          "aggregationKind": "NONE"
        }
      ],
      "literals": null,
      "propertyAssignments": null,
      "stereotypes": ["kind"],
      "isAbstract": false,
      "isDerived": false,
      "allowed": ["functional-complex"],
      "isExtensional": null,
      "isPowertype": null,
      "order": null
    },
    {
      "type": "Class",
      "id": "N0voNC6GAqAMEg_S",
      "name": "Date",
      "description": null,
      "properties": null,
      "literals": null,
      "propertyAssignments": null,
      "stereotypes": null,
      "isAbstract": false,
      "isDerived": false,
      "allowed": null,
      "isExtensional": null,
      "isPowertype": null,
      "order": null
    },
    {
      "type": "Generalization",
      "id": "_9aoNC6GAqAMEg9e",
      "name": null,
      "description": null,
      "propertyAssignments": null,
      "general": {
        "type": "Class",
        "id": "vqSoNC6GAqAMEg9H"
      },
      "specific": {
        "type": "Class",
        "id": "CIKoNC6GAqAMEg9Q"
      }
    },
    {
      "type": "Generalization",
      "id": "yC6oNC6GAqAMEg9i",
      "name": null,
      "description": null,
      "propertyAssignments": null,
      "general": {
        "type": "Class",
        "id": "vqSoNC6GAqAMEg9H"
      },
      "specific": {
        "type": "Class",
        "id": "E4qoNC6GAqAMEg9Z"
      }
    },
    {
      "type": "GeneralizationSet",
      "id": "K_loNC6GAqAMEg9s",
      "name": "NamedEntityType",
      "description": null,
      "propertyAssignments": null,
      "categorizer": null,
      "generalizations": [
        {
          "type": "Generalization",
          "id": "yC6oNC6GAqAMEg9i"
        },
        {
          "type": "Generalization",
          "id": "_9aoNC6GAqAMEg9e"
        }
      ],
      "isDisjoint": true,
      "isComplete": true
    }
  ],
  "propertyAssignments": null
}
