{
  "type": "Package",
  "id": "k_U1mg6D.AAAAQyV",
  "name": "RoleMixin1",
  "description": null,
  "contents": [
    {
      "type": "Class",
      "id": "U_U1mg6D.AAAAQyW",
      "name": "boolean",
      "description": null,
      "properties": null,
      "literals": null,
      "propertyAssignments": null,
      "stereotypes": [
        "datatype"
      ],
      "allowed": [
        "abstract"
      ],
      "isAbstract": false,
      "isDerived": false,
      "isExtensional": null,
      "isPowertype": null,
      "order": null
    },
    {
      "type": "Class",
      "id": "U_U1mg6D.AAAAQyX",
      "name": "byte",
      "description": null,
      "properties": null,
      "literals": null,
      "propertyAssignments": null,
      "stereotypes": [
        "datatype"
      ],
      "allowed": [
        "abstract"
      ],
      "isAbstract": false,
      "isDerived": false,
      "isExtensional": null,
      "isPowertype": null,
      "order": null
    },
    {
      "type": "Class",
      "id": "U_U1mg6D.AAAAQyY",
      "name": "char",
      "description": null,
      "properties": null,
      "literals": null,
      "propertyAssignments": null,
      "stereotypes": [
        "datatype"
      ],
      "allowed": [
        "abstract"
      ],
      "isAbstract": false,
      "isDerived": false,
      "isExtensional": null,
      "isPowertype": null,
      "order": null
    },
    {
      "type": "Class",
      "id": "0_U1mg6D.AAAAQyZ",
      "name": "double",
      "description": null,
      "properties": null,
      "literals": null,
      "propertyAssignments": null,
      "stereotypes": [
        "datatype"
      ],
      "allowed": [
        "abstract"
      ],
      "isAbstract": false,
      "isDerived": false,
      "isExtensional": null,
      "isPowertype": null,
      "order": null
    },
    {
      "type": "Class",
      "id": "0_U1mg6D.AAAAQya",
      "name": "float",
      "description": null,
      "properties": null,
      "literals": null,
      "propertyAssignments": null,
      "stereotypes": [
        "datatype"
      ],
      "allowed": [
        "abstract"
      ],
      "isAbstract": false,
      "isDerived": false,
      "isExtensional": null,
      "isPowertype": null,
      "order": null
    },
    {
      "type": "Class",
      "id": "0_U1mg6D.AAAAQyb",
      "name": "int",
      "description": null,
      "properties": null,
      "literals": null,
      "propertyAssignments": null,
      "stereotypes": [
        "datatype"
      ],
      "allowed": [
        "abstract"
      ],
      "isAbstract": false,
      "isDerived": false,
      "isExtensional": null,
      "isPowertype": null,
      "order": null
    },
    {
      "type": "Class",
      "id": "0_U1mg6D.AAAAQyc",
      "name": "long",
      "description": null,
      "properties": null,
      "literals": null,
      "propertyAssignments": null,
      "stereotypes": [
        "datatype"
      ],
      "allowed": [
        "abstract"
      ],
      "isAbstract": false,
      "isDerived": false,
      "isExtensional": null,
      "isPowertype": null,
      "order": null
    },
    {
      "type": "Class",
      "id": "0_U1mg6D.AAAAQyd",
      "name": "short",
      "description": null,
      "properties": null,
      "literals": null,
      "propertyAssignments": null,
      "stereotypes": [
        "datatype"
      ],
      "allowed": [
        "abstract"
      ],
      "isAbstract": false,
      "isDerived": false,
      "isExtensional": null,
      "isPowertype": null,
      "order": null
    },
    {
      "type": "Class",
      "id": "0_U1mg6D.AAAAQye",
      "name": "void",
      "description": null,
      "properties": null,
      "literals": null,
      "propertyAssignments": null,
      "stereotypes": [
        "datatype"
      ],
      "allowed": [
        "abstract"
      ],
      "isAbstract": false,
      "isDerived": false,
      "isExtensional": null,
      "isPowertype": null,
      "order": null
    },
    {
      "type": "Class",
      "id": "M_U1mg6D.AAAAQyf",
      "name": "string",
      "description": null,
      "properties": null,
      "literals": null,
      "propertyAssignments": null,
      "stereotypes": [
        "datatype"
      ],
      "allowed": [
        "abstract"
      ],
      "isAbstract": false,
      "isDerived": false,
      "isExtensional": null,
      "isPowertype": null,
      "order": null
    },
    {
      "type": "Package",
      "id": "eQxLmg6D.AAAARD9",
      "name": "Diagram1",
      "description": null,
      "propertyAssignments": null,
      "contents": [
        {
          "type": "Class",
          "id": "b7Mdmg6D.AAAARAf",
          "name": "Customer",
          "description": null,
          "properties": null,
          "literals": null,
          "propertyAssignments": null,
          "stereotypes": [
            "roleMixin"
          ],
          "allowed": [
            "functional-complex"
          ],
          "isAbstract": true,
          "isDerived": false,
          "isExtensional": null,
          "isPowertype": null,
          "order": null
        },
        {
          "type": "Class",
          "id": "Sgvzmg6D.AAAARA.",
          "name": "Private Customer",
          "description": null,
          "properties": null,
          "literals": null,
          "propertyAssignments": null,
          "stereotypes": [
            "role"
          ],
          "allowed": [
            "functional-complex"
          ],
          "isAbstract": false,
          "isDerived": false,
          "isExtensional": null,
          "isPowertype": null,
          "order": null
        },
        {
          "type": "Class",
          "id": "I3gLmg6D.AAAARBf",
          "name": "Corporate Customer",
          "description": null,
          "properties": null,
          "literals": null,
          "propertyAssignments": null,
          "stereotypes": [
            "role"
          ],
          "allowed": [
            "functional-complex"
          ],
          "isAbstract": false,
          "isDerived": false,
          "isExtensional": null,
          "isPowertype": null,
          "order": null
        },
        {
          "type": "Class",
          "id": "mKoLmg6D.AAAARB5",
          "name": "Organization",
          "description": null,
          "properties": null,
          "literals": null,
          "propertyAssignments": null,
          "stereotypes": [
            "kind"
          ],
          "allowed": [
            "functional-complex"
          ],
          "isAbstract": false,
          "isDerived": false,
          "isExtensional": null,
          "isPowertype": null,
          "order": null
        },
        {
          "type": "Class",
          "id": "RYMLmg6D.AAAARCr",
          "name": "Person",
          "description": null,
          "properties": null,
          "literals": null,
          "propertyAssignments": null,
          "stereotypes": [
            "kind"
          ],
          "allowed": [
            "functional-complex"
          ],
          "isAbstract": false,
          "isDerived": false,
          "isExtensional": null,
          "isPowertype": null,
          "order": null
        }
      ]
    },
    {
      "type": "Generalization",
      "id": "xgvzmg6D.AAAARBD",
      "name": null,
      "description": null,
      "propertyAssignments": null,
      "general": {
        "type": "Class",
        "id": "b7Mdmg6D.AAAARAf"
      },
      "specific": {
        "type": "Class",
        "id": "Sgvzmg6D.AAAARA."
      }
    },
    {
      "type": "Generalization",
      "id": "63gLmg6D.AAAARBk",
      "name": null,
      "description": null,
      "propertyAssignments": null,
      "general": {
        "type": "Class",
        "id": "b7Mdmg6D.AAAARAf"
      },
      "specific": {
        "type": "Class",
        "id": "I3gLmg6D.AAAARBf"
      }
    },
    {
      "type": "Generalization",
      "id": "eMULmg6D.AAAARCR",
      "name": null,
      "description": null,
      "propertyAssignments": null,
      "general": {
        "type": "Class",
        "id": "mKoLmg6D.AAAARB5"
      },
      "specific": {
        "type": "Class",
        "id": "I3gLmg6D.AAAARBf"
      }
    },
    {
      "type": "Generalization",
      "id": ".8CLmg6D.AAAARDJ",
      "name": null,
      "description": null,
      "propertyAssignments": null,
      "general": {
        "type": "Class",
        "id": "RYMLmg6D.AAAARCr"
      },
      "specific": {
        "type": "Class",
        "id": "Sgvzmg6D.AAAARA."
      }
    },
    {
      "type": "GeneralizationSet",
      "id": "cFaLmg6D.AAAARDp",
      "name": "Customer",
      "description": null,
      "propertyAssignments": null,
      "categorizer": null,
      "generalizations": [
        {
          "type": "Generalization",
          "id": "63gLmg6D.AAAARBk"
        },
        {
          "type": "Generalization",
          "id": "xgvzmg6D.AAAARBD"
        }
      ],
      "isDisjoint": true,
      "isComplete": true
    }
  ],
  "propertyAssignments": null
}