{
  "type": "Package",
  "id": "9wKZNC6GAqAMEodz",
  "name": "025",
  "description": null,
  "contents": [
    {
      "type": "Class",
      "id": "9wKZNC6GAqAMEod0",
      "name": "boolean",
      "description": null,
      "properties": null,
      "literals": null,
      "propertyAssignments": null,
      "stereotypes": ["datatype"],
      "isAbstract": false,
      "isDerived": false,
      "allowed": ["abstract"],
      "isExtensional": null,
      "isPowertype": null,
      "order": null
    },
    {
      "type": "Class",
      "id": "zwKZNC6GAqAMEod1",
      "name": "byte",
      "description": null,
      "properties": null,
      "literals": null,
      "propertyAssignments": null,
      "stereotypes": ["datatype"],
      "isAbstract": false,
      "isDerived": false,
      "allowed": ["abstract"],
      "isExtensional": null,
      "isPowertype": null,
      "order": null
    },
    {
      "type": "Class",
      "id": "zwKZNC6GAqAMEod2",
      "name": "char",
      "description": null,
      "properties": null,
      "literals": null,
      "propertyAssignments": null,
      "stereotypes": ["datatype"],
      "isAbstract": false,
      "isDerived": false,
      "allowed": ["abstract"],
      "isExtensional": null,
      "isPowertype": null,
      "order": null
    },
    {
      "type": "Class",
      "id": "LwKZNC6GAqAMEod3",
      "name": "double",
      "description": null,
      "properties": null,
      "literals": null,
      "propertyAssignments": null,
      "stereotypes": ["datatype"],
      "isAbstract": false,
      "isDerived": false,
      "allowed": ["abstract"],
      "isExtensional": null,
      "isPowertype": null,
      "order": null
    },
    {
      "type": "Class",
      "id": "rwKZNC6GAqAMEod4",
      "name": "float",
      "description": null,
      "properties": null,
      "literals": null,
      "propertyAssignments": null,
      "stereotypes": ["datatype"],
      "isAbstract": false,
      "isDerived": false,
      "allowed": ["abstract"],
      "isExtensional": null,
      "isPowertype": null,
      "order": null
    },
    {
      "type": "Class",
      "id": "rwKZNC6GAqAMEod5",
      "name": "int",
      "description": null,
      "properties": null,
      "literals": null,
      "propertyAssignments": null,
      "stereotypes": ["datatype"],
      "isAbstract": false,
      "isDerived": false,
      "allowed": ["abstract"],
      "isExtensional": null,
      "isPowertype": null,
      "order": null
    },
    {
      "type": "Class",
      "id": "bwKZNC6GAqAMEod6",
      "name": "long",
      "description": null,
      "properties": null,
      "literals": null,
      "propertyAssignments": null,
      "stereotypes": ["datatype"],
      "isAbstract": false,
      "isDerived": false,
      "allowed": ["abstract"],
      "isExtensional": null,
      "isPowertype": null,
      "order": null
    },
    {
      "type": "Class",
      "id": "bwKZNC6GAqAMEod7",
      "name": "short",
      "description": null,
      "properties": null,
      "literals": null,
      "propertyAssignments": null,
      "stereotypes": ["datatype"],
      "isAbstract": false,
      "isDerived": false,
      "allowed": ["abstract"],
      "isExtensional": null,
      "isPowertype": null,
      "order": null
    },
    {
      "type": "Class",
      "id": "7wKZNC6GAqAMEod8",
      "name": "void",
      "description": null,
      "properties": null,
      "literals": null,
      "propertyAssignments": null,
      "stereotypes": ["datatype"],
      "isAbstract": false,
      "isDerived": false,
      "allowed": ["abstract"],
      "isExtensional": null,
      "isPowertype": null,
      "order": null
    },
    {
      "type": "Class",
      "id": "7wKZNC6GAqAMEod9",
      "name": "string",
      "description": null,
      "properties": null,
      "literals": null,
      "propertyAssignments": null,
      "stereotypes": ["datatype"],
      "isAbstract": false,
      "isDerived": false,
      "allowed": ["abstract"],
      "isExtensional": null,
      "isPowertype": null,
      "order": null
    },
    {
      "type": "Class",
      "id": "k2aZNC6GAqAMEor_",
      "name": "SuperClass",
      "description": null,
      "properties": null,
      "literals": null,
      "propertyAssignments": null,
      "stereotypes": ["kind"],
      "isAbstract": false,
      "isDerived": false,
      "allowed": ["functional-complex"],
      "isExtensional": null,
      "isPowertype": null,
      "order": null
    },
    {
      "type": "Class",
      "id": "0X6ZNC6GAqAMEosI",
      "name": "SubClass1",
      "description": null,
      "properties": null,
      "literals": null,
      "propertyAssignments": null,
      "stereotypes": ["role"],
      "isAbstract": false,
      "isDerived": false,
      "allowed": ["functional-complex"],
      "isExtensional": null,
      "isPowertype": null,
      "order": null
    },
    {
      "type": "Class",
      "id": "4ymZNC6GAqAMEosR",
      "name": "SubClass2",
      "description": null,
      "properties": null,
      "literals": null,
      "propertyAssignments": null,
      "stereotypes": ["role"],
      "isAbstract": false,
      "isDerived": false,
      "allowed": ["functional-complex"],
      "isExtensional": null,
      "isPowertype": null,
      "order": null
    },
    {
      "type": "Class",
      "id": "rPWZNC6GAqAMEosa",
      "name": "AssociatedClass",
      "description": null,
      "properties": null,
      "literals": null,
      "propertyAssignments": null,
      "stereotypes": ["relator"],
      "isAbstract": false,
      "isDerived": false,
      "allowed": ["relator"],
      "isExtensional": null,
      "isPowertype": null,
      "order": null
    },
    {
      "type": "Generalization",
      "id": "8POZNC6GAqAMEosf",
      "name": null,
      "description": null,
      "propertyAssignments": null,
      "general": {
        "type": "Class",
        "id": "k2aZNC6GAqAMEor_"
      },
      "specific": {
        "type": "Class",
        "id": "0X6ZNC6GAqAMEosI"
      }
    },
    {
      "type": "Generalization",
      "id": "UVuZNC6GAqAMEosj",
      "name": null,
      "description": null,
      "propertyAssignments": null,
      "general": {
        "type": "Class",
        "id": "k2aZNC6GAqAMEor_"
      },
      "specific": {
        "type": "Class",
        "id": "4ymZNC6GAqAMEosR"
      }
    },
    {
      "type": "GeneralizationSet",
      "id": "1yFZNC6GAqAMEotl",
      "name": "SuperClassType",
      "description": null,
      "propertyAssignments": null,
      "categorizer": null,
      "generalizations": [
        {
          "type": "Generalization",
          "id": "8POZNC6GAqAMEosf"
        },
        {
          "type": "Generalization",
          "id": "UVuZNC6GAqAMEosj"
        }
      ],
      "isDisjoint": false,
      "isComplete": false
    },
    {
      "type": "Relation",
      "id": "w2eZNC6GAqAMEosn",
      "name": null,
      "description": null,
      "properties": [
        {
          "type": "Property",
          "id": "w2eZNC6GAqAMEoso",
          "name": null,
          "description": null,
          "propertyType": {
            "type": "Class",
            "id": "4ymZNC6GAqAMEosR"
          },
          "cardinality": "1",
          "isDerived": false,
          "isOrdered": false,
          "isReadOnly": false,
          "stereotypes": null,
          "propertyAssignments": null,
          "subsettedProperties": null,
          "redefinedProperties": null,
          "aggregationKind": "NONE"
        },
        {
          "type": "Property",
          "id": "w2eZNC6GAqAMEosq",
          "name": null,
          "description": null,
          "propertyType": {
            "type": "Class",
            "id": "rPWZNC6GAqAMEosa"
          },
          "cardinality": "1..*",
          "isDerived": false,
          "isOrdered": false,
          "isReadOnly": false,
          "stereotypes": null,
          "propertyAssignments": null,
          "subsettedProperties": null,
          "redefinedProperties": null,
          "aggregationKind": "NONE"
        }
      ],
      "propertyAssignments": null,
      "stereotypes": null,
      "isAbstract": false,
      "isDerived": false
    }
  ],
  "propertyAssignments": null
}
