{
  "type": "Package",
  "id": "3TWGNC6GAqAMEkzc",
  "name": "016",
  "description": null,
  "contents": [
    {
      "type": "Class",
      "id": "PTWGNC6GAqAMEkzd",
      "name": "boolean",
      "description": null,
      "properties": null,
      "literals": null,
      "propertyAssignments": null,
      "stereotypes": ["datatype"],
      "isAbstract": false,
      "isDerived": false,
      "allowed": ["abstract"],
      "isExtensional": null,
      "isPowertype": null,
      "order": null
    },
    {
      "type": "Class",
      "id": "AzWGNC6GAqAMEkze",
      "name": "byte",
      "description": null,
      "properties": null,
      "literals": null,
      "propertyAssignments": null,
      "stereotypes": ["datatype"],
      "isAbstract": false,
      "isDerived": false,
      "allowed": ["abstract"],
      "isExtensional": null,
      "isPowertype": null,
      "order": null
    },
    {
      "type": "Class",
      "id": "AzWGNC6GAqAMEkzf",
      "name": "char",
      "description": null,
      "properties": null,
      "literals": null,
      "propertyAssignments": null,
      "stereotypes": ["datatype"],
      "isAbstract": false,
      "isDerived": false,
      "allowed": ["abstract"],
      "isExtensional": null,
      "isPowertype": null,
      "order": null
    },
    {
      "type": "Class",
      "id": "gzWGNC6GAqAMEkzg",
      "name": "double",
      "description": null,
      "properties": null,
      "literals": null,
      "propertyAssignments": null,
      "stereotypes": ["datatype"],
      "isAbstract": false,
      "isDerived": false,
      "allowed": ["abstract"],
      "isExtensional": null,
      "isPowertype": null,
      "order": null
    },
    {
      "type": "Class",
      "id": "gzWGNC6GAqAMEkzh",
      "name": "float",
      "description": null,
      "properties": null,
      "literals": null,
      "propertyAssignments": null,
      "stereotypes": ["datatype"],
      "isAbstract": false,
      "isDerived": false,
      "allowed": ["abstract"],
      "isExtensional": null,
      "isPowertype": null,
      "order": null
    },
    {
      "type": "Class",
      "id": "QzWGNC6GAqAMEkzi",
      "name": "int",
      "description": null,
      "properties": null,
      "literals": null,
      "propertyAssignments": null,
      "stereotypes": ["datatype"],
      "isAbstract": false,
      "isDerived": false,
      "allowed": ["abstract"],
      "isExtensional": null,
      "isPowertype": null,
      "order": null
    },
    {
      "type": "Class",
      "id": "QzWGNC6GAqAMEkzj",
      "name": "long",
      "description": null,
      "properties": null,
      "literals": null,
      "propertyAssignments": null,
      "stereotypes": ["datatype"],
      "isAbstract": false,
      "isDerived": false,
      "allowed": ["abstract"],
      "isExtensional": null,
      "isPowertype": null,
      "order": null
    },
    {
      "type": "Class",
      "id": "wzWGNC6GAqAMEkzk",
      "name": "short",
      "description": null,
      "properties": null,
      "literals": null,
      "propertyAssignments": null,
      "stereotypes": ["datatype"],
      "isAbstract": false,
      "isDerived": false,
      "allowed": ["abstract"],
      "isExtensional": null,
      "isPowertype": null,
      "order": null
    },
    {
      "type": "Class",
      "id": "wzWGNC6GAqAMEkzl",
      "name": "void",
      "description": null,
      "properties": null,
      "literals": null,
      "propertyAssignments": null,
      "stereotypes": ["datatype"],
      "isAbstract": false,
      "isDerived": false,
      "allowed": ["abstract"],
      "isExtensional": null,
      "isPowertype": null,
      "order": null
    },
    {
      "type": "Class",
      "id": "IzWGNC6GAqAMEkzm",
      "name": "string",
      "description": null,
      "properties": null,
      "literals": null,
      "propertyAssignments": null,
      "stereotypes": ["datatype"],
      "isAbstract": false,
      "isDerived": false,
      "allowed": ["abstract"],
      "isExtensional": null,
      "isPowertype": null,
      "order": null
    },
    {
      "type": "Class",
      "id": "R5BGNC6GAqAMElBn",
      "name": "Person",
      "description": null,
      "properties": [
        {
          "type": "Property",
          "id": "aENGNC6GAqAMElC5",
          "name": "birthDate",
          "description": null,
          "propertyType": {
            "type": "Class",
            "id": "E4RGNC6GAqAMElBw"
          },
          "cardinality": "1",
          "isDerived": false,
          "isOrdered": false,
          "isReadOnly": false,
          "stereotypes": null,
          "propertyAssignments": null,
          "subsettedProperties": null,
          "redefinedProperties": null,
          "aggregationKind": "NONE"
        }
      ],
      "literals": null,
      "propertyAssignments": null,
      "stereotypes": ["kind"],
      "isAbstract": false,
      "isDerived": false,
      "allowed": ["functional-complex"],
      "isExtensional": null,
      "isPowertype": null,
      "order": null
    },
    {
      "type": "Class",
      "id": "E4RGNC6GAqAMElBw",
      "name": "Date",
      "description": null,
      "properties": null,
      "literals": null,
      "propertyAssignments": null,
      "stereotypes": null,
      "isAbstract": false,
      "isDerived": false,
      "allowed": null,
      "isExtensional": null,
      "isPowertype": null,
      "order": null
    },
    {
      "type": "Class",
      "id": "XBxGNC6GAqAMElB5",
      "name": "Adult",
      "description": null,
      "properties": null,
      "literals": null,
      "propertyAssignments": null,
      "stereotypes": ["phase"],
      "isAbstract": false,
      "isDerived": false,
      "allowed": ["functional-complex"],
      "isExtensional": null,
      "isPowertype": null,
      "order": null
    },
    {
      "type": "Class",
      "id": "kRJGNC6GAqAMElCC",
      "name": "Employee",
      "description": null,
      "properties": [
        {
          "type": "Property",
          "id": "FHTGNC6GAqAMElDM",
          "name": "test",
          "description": null,
          "propertyType": {
            "type": "Class",
            "id": "QzWGNC6GAqAMEkzi"
          },
          "cardinality": "1",
          "isDerived": false,
          "isOrdered": false,
          "isReadOnly": false,
          "stereotypes": null,
          "propertyAssignments": null,
          "subsettedProperties": null,
          "redefinedProperties": null,
          "aggregationKind": "NONE"
        }
      ],
      "literals": null,
      "propertyAssignments": null,
      "stereotypes": ["role"],
      "isAbstract": false,
      "isDerived": false,
      "allowed": ["functional-complex"],
      "isExtensional": null,
      "isPowertype": null,
      "order": null
    },
    {
      "type": "Class",
      "id": "9IZGNC6GAqAMElCL",
      "name": "Employment",
      "description": null,
      "properties": [
        {
          "type": "Property",
          "id": "WXbGNC6GAqAMElDd",
          "name": "salary",
          "description": null,
          "propertyType": {
            "type": "Class",
            "id": "gzWGNC6GAqAMEkzg"
          },
          "cardinality": "1",
          "isDerived": false,
          "isOrdered": false,
          "isReadOnly": false,
          "stereotypes": null,
          "propertyAssignments": null,
          "subsettedProperties": null,
          "redefinedProperties": null,
          "aggregationKind": "NONE"
        }
      ],
      "literals": null,
      "propertyAssignments": null,
      "stereotypes": ["relator"],
      "isAbstract": false,
      "isDerived": false,
      "allowed": ["relator"],
      "isExtensional": null,
      "isPowertype": null,
      "order": null
    },
    {
      "type": "Generalization",
      "id": "fGXGNC6GAqAMElDv",
      "name": null,
      "description": null,
      "propertyAssignments": null,
      "general": {
        "type": "Class",
        "id": "R5BGNC6GAqAMElBn"
      },
      "specific": {
        "type": "Class",
        "id": "XBxGNC6GAqAMElB5"
      }
    },
    {
      "type": "Generalization",
      "id": "kvXGNC6GAqAMElDz",
      "name": null,
      "description": null,
      "propertyAssignments": null,
      "general": {
        "type": "Class",
        "id": "XBxGNC6GAqAMElB5"
      },
      "specific": {
        "type": "Class",
        "id": "kRJGNC6GAqAMElCC"
      }
    },
    {
      "type": "Relation",
      "id": "Zx3GNC6GAqAMElD3",
      "name": null,
      "description": null,
      "properties": [
        {
          "type": "Property",
          "id": "Zx3GNC6GAqAMElD4",
          "name": null,
          "description": null,
          "propertyType": {
            "type": "Class",
            "id": "9IZGNC6GAqAMElCL"
          },
          "cardinality": "1..*",
          "isDerived": false,
          "isOrdered": false,
          "isReadOnly": false,
          "stereotypes": null,
          "propertyAssignments": null,
          "subsettedProperties": null,
          "redefinedProperties": null,
          "aggregationKind": "NONE"
        },
        {
          "type": "Property",
          "id": "Zx3GNC6GAqAMElD6",
          "name": null,
          "description": null,
          "propertyType": {
            "type": "Class",
            "id": "kRJGNC6GAqAMElCC"
          },
          "cardinality": "1",
          "isDerived": false,
          "isOrdered": false,
          "isReadOnly": false,
          "stereotypes": null,
          "propertyAssignments": null,
          "subsettedProperties": null,
          "redefinedProperties": null,
          "aggregationKind": "NONE"
        }
      ],
      "propertyAssignments": null,
      "stereotypes": null,
      "isAbstract": false,
      "isDerived": false
    }
  ],
  "propertyAssignments": null
}
